id,title,authors,venue,year
3943,extracting entity profiles from semistructured information spaces,"ra nado , sb huffman","sigmod record ,",1997
3944,persistent threads,"f matthes , jw schmidt","proceedings of the international conference on very large & hellip ; ,",1994
3945,databases and workflow management : what is it all about ? ( panel ),"a reuter , s ceri , j gray , b salzberg , g weikum","proceedings of the 21th international conference on very & hellip ; ,",1995
3946,discovery of multiple-level rule s from large database,"j han , y fu",,
3947,using latency-recency profiles for data delivery on the web,"l bright , l raschid","vldb ,",2002
3948,computing iceberg queries ecientlyproc . 1996 int,"m fang , n shivakumar , hg molina , r motwani , jd","conf . very large data bases ,",
3949,winmagic : subquery elimination using window aggregation,"c zuzarte , w ma , l liu","proceedings of the 2003 acm sigmod international conference & hellip ; ,",2003
3950,integrating association rule mining with relational database systems : alternatives and implications,"s sarawagi , s thomas , r agrawal","data mining and knowledge discovery ,",2000
3951,enabling . enabling dynamic content caching for database-driven web sites,"ks candan , ws li , q luo , wp hsiung , d agrawal",acm,
3952,a logical foundation for deductive object-oriented databases,"m liu , g dobbie , tw ling","acm transactions on database systems ,",2002
3953,data mining-based intrusion detectors : an overview of the columbia ids project,"sj stolfo , w lee , pk chan , w fan , e eskin","sigmod record ,",2001
3954,of objects and databases : a decade of turmoil,"mj carey , dj dewitt","vldb ,",1996
3955,response to â ?? a close look at the ifo data modelâ ??,"s abiteboul , r hull","acm sigmod record ,",1995
3956,mining generfized association rules,"r srikant , r agrawal","proc . 1995 int . conf . very large data bases , zrich ,",
3957,rate-based query optimization for streaming information sources,"s viglas , jf naughton","sigmod conference ,",2002
3958,low-cost compensation-based query processing,", so hvasshovd","proceedings of the international conference on very large & hellip ; ,",1998
3959,sql standardization : the next steps .,acms anthology,"sigmod record ,",2000
3960,object fusion in mediator systems ( extended version ) . available by anonymous ftp at db,"y papakonstantinou , h garcia-molina",stanford . edu as the le/pub/papakonstantinou / 1995/fusion -,
3961,xml-based information meditiation with mix,"ck brau , a gupta , b ludã $ her , r marciano , y",,1999
3962,a query language for a web-site management system,"d florescu , a levy , m fernandez , d suciu","sigmod record ,",
3963,the strip rule system for efficiently maintaining derived data,"b adelberg , h garcia-molina , j widom","sigmod conference ,",1997
3964,the effectiveness of gloss for the text database discovery problems,"lgh garcia-molina , a tomasic","i > proc . sigmod conf. , < / i > acm press , new york ,",
3965,streaming queries over streaming data,"s chandrasekaran , mj franklin","vldb ,",2002
3966,approximatemediansandother quantilesinonepass and with limited memory,"gs manku , s rajagopalan , bg lindsay","proceedings of acm sigmod ,",
3967,extraction of object-oriented structures from existing relational databases,"s ramanathan , j hodges","sigmod record ,",1997
3968,"intelligence with the ubiquitous network , the embedded computer devices and the hidden databases (",ej sol,"proceedings of the 27th international conference on very & hellip ; ,",2001
3969,balancing pushand pullfordata broadcast,"s acharya , m franklin , s zdonik","inproceedings of the acm sigmod international conference on & hellip ; ,",
3970,design and development of a stream service in a heterogeneous client environment ( research ),"n pappas , s christodoulakis","proceedings of the international conference on very large & hellip ; ,",
3971,optimizing database architecture for the new bottleneck : memory access ( extended paper published for,"p boncz , s manegold , m kersten","the vldb journal ,",
3972,belief reasoning in mls deductive databases,hm jamil,"sigmod conference ,",1999
3973,what happens during a join ? dissecting cpu and memory optimization effects,"s manegold , p boncz , ml kersten",,
3974,irisnet : an architecture for internet-scale sensing,"pb gibbons , b karp , y ke , s nath , s seshan",,
3975,an effective algorithm for mining of association rules,js parkâ ? ¦,"proceedings of acm sigmod conference on management of data , & hellip ; ,",
3976,repeating history beyond aries,c mohan,"vldb ,",1999
3977,concurrency control in hierarchical multidatabase systems,"s mehrotra , hf korth , a silberschatz","the vldb journal the international journal on very large & hellip ; ,",1997
3978,similarity-based queries for sequences data,"d rafiei , a mendelzon",proc . of the acm sigmod conference on management of data (,
3979,caprera : an activity framework for transaction processing on wide-area networks,"s kumar , ek kwang , d agrawal","proceedings of the international conference on very large & hellip ; ,",1997
3980,a region splitting strategy for physical database design of multidimensional file organizations,"jh lee , yk lee , ky whang","vldb ,",1997
3981,self-tuning histograms : building histograms without looking at data,"aa ac , s chaudhuri",proceedings of the acm sigmod international conference on,
3982,discover : keyword search in relational databases,"v hristidis , y papakonstantinou","vldb ,",2002
3983,qxtract : a building block for efficient information extraction from text databases,"e agichtein , l gravano","proceedings of the 2003 acm sigmod international conference & hellip ; ,",2003
3984,1998 . unbundling active functionality,s gatziuâ ? ¦,acm sigmod,
3985,improved query performance with variant indexes,"eon patrick , d quass","sigmod conference ,",
3986,report on dart ' 96 : databases : active and real-time ( concepts meet practice ),"k ramamritham , n soparkar","sigmod record ,",1997
3987,a query languageand optimizationtechnieques for unstructured data,"p buneman , s davidson , g hillebrand , d suciu",proceedings of the acm sigmod international conference on,
3988,a complete temporal relational algebra,"d dey , tm barron , vc storey","the vldb journal the international journal on very large & hellip ; ,",1996
3989,an on-line self-tuning markov histogram for xml path selectivity estimation,"l lim , m wang , s padamanabhan , js vitter , rxpl",proceedings of,
3990,efficient user-adaptable similarity search in large multimedia databases,"t seidl , hp kriegel","vldb ,",1997
3991,modelling temporal thematic map contents,e pourabbas,"sigmod record ,",2003
3992,rastogi r. shim k. spirit : sequential pattern mining with regular expression constraints,m garofalkis,"proc . 1999 int . conf . very large data bases ( vldbâ ?? 99 ) , & hellip ; ,",
3993,generating spatiotemporal datasets on the www .,acms anthology,"sigmod record ,",2000
3994,mining generalized association rules ( expanded version ),"r srikant , r agrawal","technical report rj9963 , ibm research division , almaden research",
3995,an empirical performance study of the ingres search accelerator for a large property management,"ss anand , da bell","proceedings of the international conference on very large & hellip ; ,",1994
3996,accessing a relational database through an object-oriented database interface,j orenstein,"proceedings of the international conference on very large & hellip ; ,",1995
3997,algorithmsfordeferred view maintenance,"ls colby , t griffin , l libkin , is mumick , h",proc . of the acm sigmod,
3998,a taxonomy for object-oriented secure databases,"m olivier , s von solms","acm tods ,",
3999,the microsoft repository,"b harry , p sanders , pa bernstein , d shutt , j",,
4000,the query optimizer in tandem 's new serverware sql product,p celis,"proceedings of the international conference on very large & hellip ; ,",1996
4001,"jasonmadar , and raymond ng . semantic compression and pattern extraction with fascicles",hv jagadish,& hellip ; of the25th international conference onverylarge,
4002,semantic and schematic similarities between database objects : a context-based approach,"v kashyap , a sheth","the vldb journal the international journal on very large & hellip ; ,",1996
4003,w3qs : a querysystem fortheworld-wide web,dko shmueli,intl. conference on very large data bases,
4004,high-performance sorting on networks of workstations,"ac arpaci-dusseau , rh arpaci-dusseau , de culler ,","sigmod conference ,",1997
4005,ã cents â ? ¬ å?multiple - view self-maintenance in data warehousing environmentsã cents â ? ¬ â ?,n huyn,"proc . 23rd vldb ,",
4006,query by diagram : a graphical environment for querying databases,"t catarci , g santucci","sigmod conference ,",1994
4007,"ã cents â ? ¬ å?the bucky object relational benchmark , ''","mj carey , dj dewitt , jf naughton , m asgarian , p","proceedings of the sigmod conference on management of data , & hellip ; ,",
4008,xml repository and active views demonstration,s abiteboul,"proceedings of the international conference on very large & hellip ; ,",1999
4009,discovering marketing intelligence through online analytical web usage mining,"a buchner , m mulvenna",sigmod,
4010,to weave the web,"p atzeni , g mecca , p merialdo","vldb ,",1997
4011,new neighbor search in large metric space,s brin,proceedings of the,
4012,index concurrency control in firm real-time databases,sr narayanan,,1997
4013,expiring data from the warehouse . 1997,"wj labio , h garcia-molina",stanford university :,
4014,'' spartan : a model-based semantic compression system for massive data tables,"s babu , m garofalakis , r rastogi","acm sigmod record ,",2001
4015,xml data management : go native or spruce up relational systems ?,pa larson,"sigmod record ,",2001
4016,v. shrinivasan accessing relational databases from the world wide web,t nguyen,"proc . of acm sigmod int . conf . on management of data ,",
4017,xml-enabled workflow management for e-services across heterogeneous platforms,"g shegalov , m gillmann , g weikum","the vldb journal the international journal on very large & hellip ; ,",2001
4018,an approximate search engine for structural databases,"jtl wang , x wang , d shasha , ba shapiro , k zhang","proceedings of the 2000 acm sigmod int . conf . on management & hellip ; ,",2000
4019,"preference sql -- design , implementation , experiences","w kieî ² ling , g kã ¶ stler","proceedings of the 28th international conference on very & hellip ; ,",
4020,efficient dynamic mining of constrained frequent sets,"lvs lakshmanan , cks leung , rt ng","acm transactions on database systems ,",2003
4021,an adaptive query execution system for data integration,"zg ives , d florescu , m friedman , a levy , ds weld","sigmod conference ,",1999
4022,t1gukat : a uniform behavioral objectbase management system,"mt ozsu , r peters , d szafron , b irani , a lipka , a","vldb journal ,",
4023,"neil , and d. shasha . the dangers of replication and a solution","j gray , p helland , p oã cents",proceedings of the acm sigmod,
4024,client-site query extensions,"t mayr , p seshadri","sigmod conference ,",1999
4025,fast algorithms for projective clustering,"cc aggarwal , cm procopiuc , jl wolf , ps yu , js park","proc . of acm-sigmod intl. conf . on management of data ,",
4026,an effective hash-based algorithm for mining association rules . in : proc . of the 1995 acm sigmod,js park,,1995
4027,cure : an efficient clustering algorithm for large data sets,"s guha , r rastogi , k shim","published in the proceedings of the acm sigmod conference ,",
4028,"krishna , kulkarni , peter schwarz , kathy zeidenstein , sql and management of external data","j melton , je michels , v josifovski","sigmod record , mar ,",
4029,dynamic service matchmaking among agents in open information environments,"k sycara , m klusch , s widoff , j lu","sigmod record ,",1999
4030,similarity search in high dimensional via hashing,"a gionis , p indyk , r motwani","proceedings of the 25th international conference on very & hellip ; ,",
4031,real world requirements for decision support-implications for rdbms,sk bansal,,
4032,efficient algorithms for processing xpath queries,"g georg , k christoph , p reinhard","proc . of the vldb ,",
4033,materialized view selection in a multi-dimensional datacube,"e baralis , s paraboschi , e teniente",,1997
4034,turbo-charging vertical mining of large databases . in 2000 acm sigmod intl,"p shenoy , jr haritsa , s sudarshan , g bhalotia , m",conference on management of,
4035,the merge/purge problem for large databases,"ma hernandez , sj stolfo","proceedings of the 1995 acm sigmod international conference & hellip ; ,",1995
4036,prospector : a content-based multimedia server for massively parallel architectures,"woâ ?? connell , it ieong , d schrader , c watson , g au",proceedingsof the 1996 acm sigmod international conference,
4037,bg lindsay random sampling techniques for space efficient online computation of order statistics of,"gs manku , s rajagopalan",proc . sigmodâ ?? 99 int &#39; l conf . on management of,
4038,pesto : an integrated query/browser for object databases,", v maganty","vldb ,",1996
4039,on-line reorganization of sparsely-populated b trees,"c zou , b salzberg","proc acm sigmod conference ,",
4040,exact : an extensible approach to active object-oriented databases,"o dãaz , a jaime","the vldb journal the international journal on very large & hellip ; ,",1997
4041,re-designing distance functions and distance based applications for high dimensional data,cc aggarwal,"sigmod record ,",2001
4042,on parallel execution of multiple pipelined hash joins,"ms chen , h hsiao , ps yu",proc . of acm sigmod,
4043,"g. graefe , optimization of dynamic query evaluation plans",rl cole,proc . of the/994 acm,
4044,qbi : query by icons,"a massari , l saladini",,
4045,"using taxonomy , dicriminants , and signatures to navigate in text databases","s chakrabarti , b dom , r agrawal , p raghavan",,
4046,energy efficient indexing on air,"t imielinsky , s viswanathan , br badrinath","proc . of intl. conf . on managm . of data-acm-sigmod ,",
4047,eflective memory we in a media server,"e chang , h garcia-molina","proceedings of the 233rd vldb conference ,",
4048,indexing on air,svtibr badrinath,"proceedings of the 1994 acm sigmod ,",
4049,semantic interoperability in global information systems : a brief introduction to the research and,"a ouksel , a sheth","acm sigmod record . special section on semantic & hellip ; ,",
4050,mining generalized association rules,"s ramakrishnan , a rakesh","proceedings of 21 stvldb conference , zurich , switzerland ,",
4051,in memory of bob kooi ( 1951â ?? 1993 ),m stonebraker,"acm sigmod record ,",1994
4052,metadata standards for data warehousing : open information model vs. common warehouse metamodel,gc introduction,,
4053,thinksheet : a tool for tailoring complex documents,"p piatko , r yangarber , d lin , d shasha","proceedings of the 1996 acm sigmod international conference & hellip ; ,",1996
4054,contorting high dimensional data for efficient main memory knn processing,"b cui , bc ooi , j su , kl tan","proceedings of the acm sigmod international conference on & hellip ; ,",2003
4055,storing semi-structured data using stored,"a deutsch , m fernandez , d suciu","proc. , acm sigmod ,",
4056,h ~ etor garefa-molina . merging ranks from heterogeneous internet sources,l gravano,"technical report sidl-wp-1997-0063 , dept. of computer science ,",
4057,a content-based multimedia server for massively parallel architectures,"wo ` connell , it ieong , d schrader , c watson , g au ,","sigmod conference ,",
4058,special issue : metadata for digital media,"w klas , a sheth","sigmod record ,",
4059,scientific databases-state of the art and future directions,"m zemankova , ye ioannidis","proceedings of the international conference on very large & hellip ; ,",1994
4060,dual-buffer strategies in object bases,"a kemper , d kossmann",20th int . conf . on very large data bases,
4061,leo å ? db2â ?? s learning optimizer,"m stillger , gm lohman , v markl , m kandil","the vldb journal ,",
4062,a brief survey of web data extraction tools,"ahf laender , ba ribeiro-neto , js teixeira","sigmod record ,",2002
4063,query execution strategies for caching expensive methods,"j hellerstein , j naughton","proc . of the acm sigmod conf . on management of data ,",
4064,quasi-cubes : exploiting approximations in multidimensional databases,"d barbara , m sullivan","sigmod record ,",1997
4065,using quantitative information for ef-f-ficient ficient aasssociation rule generation sociation rule,"b pã ´ ssas , w meira jr , m carvalho , rrb pã ´ ssas , r",,
4066,the mlpq/gis constraint database,"pz revesz , r chen , p kanjamala , y li , y liu , y","proceedings of sigmod 2000 ,",
4067,declarative specification of web sites with strudel,"m fernã ¡ ndez , d florescu , a levy , d suciu","the vldb journal the international journal on very large & hellip ; ,",2000
4068,an evaluation of generic bulk loading techniques,"j den bercken , b seeger","proceedings of the international conference on very large & hellip ; ,",2001
4069,hierarchical compact cube for range-max queries,"hg li , tw ling , sy lee",proceedings of the 26th vldb,
4070,"k. , garcia-molina , h. , and paepcke , a. ( 1997 ) . starts : stanford proposal for internet metasearching","l gravano , cc chang",acm sigmod int . conf . on management of,
4071,maximizing the output rate of multi-way join queries over streaming information sources,"s viglas , jf naughton , j burger","proceedings of the international conference on very large & hellip ; ,",2003
4072,"1 . mumick , and y. sagiv . query optimization by predicate move-around",a levy,"proc . of the int . conf . on very large data bases ,",
4073,fast algorithms for mining association rules in large database,"a rakesh , r srikant",,1994
4074,"s. navathe , â ?? an efficient algorithm for mining association rules in large database , â ??","a savasere , e omiecinski",proc . internal conf . very large data,
4075,performance of data-parallel spat ial operations,"eg hoelt , h samet",,
4076,managing uncertainty in sensor databases,"r cheng , s prabhakar","sigmod record ,",2003
4077,energy e cient indexing on air,"t imielinski , s viswanathan , b badrinath","proc . acm sigmod international conference on management of & hellip ; ,",
4078,", a. sahuguet , fabien azavant , building light-weight wrappers for legacy web data-sources using w4f",a sahuguet,"ecole nationale supã © rieure des tã © lã © communications , paris ,",
4079,efficient and extensible algorithms for multi query optimization,"ps seshadri , s sudarshan , s bhobe","proc . sigmod , dallas , usa ,",
4080,update propagation strategies for improving the quality of data on the web,"a labrinidis , n roussopoulos","vldb ,",2001
4081,a. silberschatz s. sudarshan . dali : a high performance main memory storage manager,hvjdlr rastogi,"proceedings of the vldb conference ,",
4082,beyond market baskets : generalizing association rules to correlations,"c silverstein , r motwani , s brin","proc . acm sigmod conf ,",
4083,disseminating updates on broadcast disks,"s acharya , mj franklin , s zdonik","proceedings of the international conference on very large & hellip ; ,",1996
4084,schema mapping as query discovery,"rj miller , lm haas , ma hernã ¡ ndez","proceedings of the 26th international conference on very & hellip ; ,",2000
4085,continuous k-nearest neighbor queries for continuously moving points with updates,"gs iwerks , h samet , k smith","proceedings of the international conference on very large & hellip ; ,",2003
4086,comparative analysis of five xml languages,"a bonifati , s ceri","sigmod record ,",
4087,optimizing queries across diverse data sources,"lm hass , d kossmann , el wimmers , j yang , l raschid","proceedings of the 23rd vldb conference , athens , greece , acm & hellip ; ,",
4088,comparative analysis of six xml schema languages . cf,"d lee , w chu",,
4089,the bucky object-relational benchmark ( experience paper ),"mj carey , dj dewitt , jf naughton , m asgarian , p","sigmod conference ,",
4090,webview materialization,"a labrinidis , n roussopoulos",,
4091,semantic b2b integration : issues in ontology-based approaches,", d jones","sigmod record ,",2002
4092,fast algorithms for maintaining replica consistency in lazy master replicated databases,"e pacitti , p minet , e simon","vldb ,",1999
4093,comparing hybrid peer-to-peer systems,"y beverly , gm hector","technical report , stanford university stanford ,",
4094,delivering high availability for inktomi search engines,ea brewer,"sigmod conference ,",1998
4095,internet traffic warehouse,"cm chen , m cochinwala , c petrone , m pucci , s","acm sigmod record ,",2000
4096,efficient concurrency control for bdisks environments,", a nithrakashyap , r sivasankaran , k ramamritham","proc . acm sigmod intâ ?? l conf . management of data ,",
4097,mining generalized association rules ; proceedings of the 21,"r srikant , r agrawal",vldb,
4098,the multidimensional database system rasdaman,"p baumann , a dehmel , p furtado , r ritsch , n",,
4099,"m. , and widoff s. : dynamic service matchmaking among agents in open information environments","k sycara , k lu","journal acm sigmod record , special issue on semantic",
4100,wrapper generation for semi-structured information sources,"n asish , c knoblock","acm sigmod ,",
4101,andprabhakarraghavan . automaticsubspaceclusteringof highdimensional data for data mining,"jg rakeshagrawal , d gunopolos","acm sigmod conference ,",
4102,architectures for internal web services deployment,s oded,,2001
4103,towards adaptive workflow systems : cscw-98 workshop report,"a bernstein , c dellarocas , m klein","acm siggroup bulletin ,",1999
4104,inverted files versus signature files for text indexing,"j zobel , a moffat , k ramamohanarao","acm transactions on database systems ,",1998
4105,mining quantitative association rules in large relational tables,"r agrawal , r srikant",,1996
4106,towards an infrastructure for temporal databases-a workshop report,n pissinoti,"sigmod record ,",1994
4107,aggregate-query processing in data warehousing environments,"ag ghqw , v harinarayan , d quass","proc . of the 21st vldb co @ , zurich , switzerland ,",
4108,analyzing quantitative databases : image is everything,"a amir , r kashi , ns netanyahu","proceedings of the international conference on very large & hellip ; ,",2001
4109,grid data management systems & services,"a jagatheesan , r moore","proceedings of the international conference on very large & hellip ; ,",2003
4110,t.â ?? data warehouse configurationâ ??,ds theodoratos,"proc . 23 rdvldb conference , greece ,",
4111,the pointcast network ( abstract ),"s ramakrishnan , v dayal","acm sigmod record ,",1998
4112,"j. grandbois , m. jou , n. mattos , b. tran , and y. wang . high level indexing of userâ ?? defined types","w chen , j chow , y fuh","25th vldb conference ,",
4113,"special section on advanced xml data processing : preservation of digital data with self-validating ,","b ludasher , r marciano , r moore","acm sigmod record , september ,",
4114,efficient construction of regression trees with range and region splitting,"m yasuhiko , i hiromu , m shinichi","proceedings of the 23rd vldb conference ,",1997
4115,towards an odmg-compliant visual object query language,"m chavda , pt wood","vldb ,",1997
4116,quality-driven integration of heterogeneous information systems,"f naumann , u leser , jc freytag","proceedings of the international conference on very large & hellip ; ,",1999
4117,papakonstantinou . describing andusingquerycapabilities ofheterogeneous sources,v vassalosandy,proceedings of international conference on very large,
4118,analysis of n-dimensional quadtrees using the hausdorff fractal dimension,"c faloutsos , v gaede","proceedings of the 22th international conference on very & hellip ; ,",1996
4119,semint : a system prototype for semantic integration in heterogeneous databases,"ws li , c clifton","proceedings of the 1995 acm sigmod international conference & hellip ; ,",1995
4120,on computing correlated aggregates over continuous data streams,"j gehrke , f korn , d srivastava",,
4121,datasplash,"c olston , a woodruff , a aiken , m chu , v ercegovac ,","sigmod conference ,",1998
4122,on shoring up persistent applications,m zwillingâ ? ¦,"proc . of acm sigmod ,",
4123,efficient management of multiversion documents by object referencing,"sy chien , vj tsotras , c zaniolo","proceedings of the international conference on very large & hellip ; ,",2001
4124,views in a large scale xml database,"v aguilera , s cluet , t milo , d vodislav , p veltri","vldb journal ,",
4125,the case for enhanced abstract data types praveen seshadri,"p sesshadri , m livny , r ramakrishnan",,
4126,materialized view selection for multidimensional database,"a shukla , p deshpande","proceedings of 24 international conference on very large & hellip ; ,",
4127,"an orthogonally persistent java acm sigmod record , 25 , 4","mp atkinson , l daynes , mj jordan , t printezis , s",,
4128,â ?? streaming queries over streaming data,"s chandrasekan , m franklin",,2002
4129,your mediators need data conversation,"s cluet , c delobel , j simeon , k smaga",proceedings of acm-sigmod international,
4130,database research at columbia university .,acms anthology,"sigmod record ,",1998
4131,mind your vocabulary : query mapping across heterogeneous information sources . acm sigmod int,"cck chang , h garcia-molina","conference on management of data ,",
4132,coss : the common object services specifications,be martin,"proceedings of the 1994 acm sigmod international conference & hellip ; ,",1994
