id,title,authors,venue,year
2231,concurrency control in hierarchical multidatabase systems,"s mehrotra , h korth , a silberschatz",vldb j.,1997
2232,graphical interaction with heterogeneous databases,"t catarci , g santucci , j cardiff",vldb j.,1997
2233,a database model for object dynamics,"m papazoglou , b krфmer",vldb j.,1997
2234,a logical view of structured files,"s abiteboul , s cluet , t milo",vldb j.,1998
2235,fast image retrieval using color-spatial information,"b ooi , k tan , t chua , w hsu",vldb j.,1998
2236,"scalable feature selection , classification and signature generation for organizing large text databases into hierarchical topic taxonomies","s chakrabarti , b dom , r agrawal , p raghavan",vldb j.,1998
2237,integrating reliable memory in databases,"w ng , p chen",vldb j.,1998
2238,garbage collection in object-oriented databases using transactional cyclic reference counting,"p roy , s seshadri , a silberschatz , s sudarshan , s ashwin",vldb j.,1998
2239,integrated document caching and prefetching in storage hierarchies based on markov-chain predictions,"a kraiss , g weikum",vldb j.,1998
2240,integrating symbolic images into a multimedia database system using classification and abstraction approaches,"a soffer , h samet",vldb j.,1998
2241,enhanced abstract data types in object-relational databases,p seshadri,vldb j.,1998
2242,exact : an extensible approach to active object-oriented databases,"o dэaz , a jaime",vldb j.,1997
2243,query processing over object views of relational data,"g fahl , t risch",vldb j.,1997
2244,"optimizing relational queries in connection hypergraphs : nested queries , views , and binding propagations",j han,vldb j.,1998
2245,the oodb path-method generator ( pmg ) using access weights and precomputed access relevance,"a mehta , j geller , y perl , e neuhold",vldb j.,1998
2246,a flexible and recoverable client/server database event notification system,"e hanson , i chen , r dastur , k engel , v ramaswamy , w tan , c xu",vldb j.,1998
2247,data partitioning and load balancing in parallel disk systems,"p scheuermann , g weikum , p zabback",vldb j.,1998
2248,maintenance of implication integrity constraints under updates to constraints,"n ishakbeyoglu , z жzsoyoglu",vldb j.,1998
2249,"advanced data processing in krisys : modeling concepts , implementation techniques , and client/server issues","s deпloch , t hфrder , n mattos , b mitschang , j thomas",vldb j.,1998
2250,data page layouts for relational databases on deep memory hierarchies,"a ailamaki , d dewitt , m hill",vldb j.,2002
2251,database indexing for large dna and protein sequence collections,"e hunt , m atkinson , r irving",vldb j.,2002
2252,views in a large-scale xml repository,"v aguilera , s cluet , t milo , p veltri , d vodislav",vldb j.,2002
2253,editorial,,,2002
2254,a template model for multidimensional inter-transactional association rules,"l feng , j yu , h lu , j han",vldb j.,2002
2255,efficient similarity search for market basket data,"a nanopoulos , y manolopoulos",vldb j.,2002
2256,speeding up construction of pmr quadtree-based spatial indexes,"g hjaltason , h samet",vldb j.,2002
2257,spatial indexing of high-dimensional data based on relative approximation,"y sakurai , m yoshikawa , s uemura , h kojima",vldb j.,2002
2258,an authorization system for digital libraries,"e ferrari , n adam , v atluri , e bertino , u capuozzo",vldb j.,2002
2259,efficient retrieval of similar shapes,"d rafiei , a mendelzon",vldb j.,2002
2260,searching in metric spaces by spatial approximation,g navarro,vldb j.,2002
2261,indexing of now-relative spatio-bitemporal data,"s saltenis , c jensen",vldb j.,2002
2262,query processing techniques for arrays,"a marathe , k salem",vldb j.,2002
2263,locating and accessing data repositories with websemantics,"g mihaila , l raschid , a tomasic",vldb j.,2002
2264,global transaction support for workflow management systems : from formal specification to practical implementation,"p grefen , j vonk , p apers",vldb j.,2001
2265,answering queries using views : a survey,a halevy,vldb j.,2001
2266,psoup : a system for streaming queries over streaming data,"s chandrasekaran , m franklin",vldb j.,2003
2267,"watermarking relational data : framework , algorithms and analysis","r agrawal , p haas , j kiernan",vldb j.,2003
2268,complex relationships and knowledge discovery support in the infoquilt system,"a sheth , s thacker , s patel",vldb j.,2003
2269,a bayesian decision model for cost optimal record matching,"v verykios , g moustakides , m elfeky",vldb j.,2003
2270,business-to-business interactions : issues and enabling technologies,"b medjahed , b benatallah , a bouguettaya , a ngu , a elmagarmid",vldb j.,2003
2271,new partnership with acm and update on the journal,m жzsu,vldb j.,2003
2272,lineage tracing for general data warehouse transformations,"y cui , j widom",vldb j.,2003
2273,efficient schemes for managing multiversionxml documents,"s chien , v tsotras , c zaniolo",vldb j.,2002
2274,efficient filtering of xml documents with xpath expressions,"c chan , p felber , m garofalakis , r rastogi",vldb j.,2002
2275,an xml query engine for network-bound data,"z ives , a halevy , d weld",vldb j.,2002
2276,guest editorial,,,2002
2277,timber : a native xml database,"h jagadish , s al-khalifa , a chapman , l lakshmanan , a nierman , s paparizos , j patel , d srivastava , n wiwatwattana , y wu , c yu",vldb j.,2002
2278,anatomy of a native xml base management system,"t fiebig , s helmer , c kanne , g moerkotte , j neumann , r schiele , t westmann",vldb j.,2002
2279,tree pattern query minimization,"s amer-yahia , s cho , l lakshmanan , d srivastava",vldb j.,2002
2280,energy-performance trade-offs for spatial access methods on memory-resident data,"n an , s gurumurthi , a sivasubramaniam , n vijaykrishnan , m kandemir , m irwin",vldb j.,2002
2281,a formal perspective on the view selection problem,"r chirkova , a halevy , d suciu",vldb j.,2002
2282,a graph-theoretic model for optimizing queries involving methods,"c lee , c shih , y chen",vldb j.,2001
2283,combining multi-visual features for efficient indexing in a large image database,"a ngu , q sheng , d huynh , r lei",vldb j.,2001
2284,xml-enabled workflow management for e-services across heterogeneous platforms,"g shegalov , m gillmann , g weikum",vldb j.,2001
2285,objectglobe : ubiquitous query processing on the internet,"r braumandl , m keidl , a kemper , d kossmann , a kreutz , s seltzsam , k stocker",vldb j.,2001
2286,context-based prefetch - an optimization for implementing objects on relations,"p bernstein , s pal , d shutt",vldb j.,2000
2287,indexing very high-dimensional sparse and quasi-sparse vectors for similarity searches,"c wang , x wang",vldb j.,2001
2288,supporting efficient multimedia database exploration,"w li , k candan , k hirata , y hara",vldb j.,2001
2289,hmap - a temporal data model managing intervals with different granularities and indeterminacy from natural language sentences,"c combi , g pozzi",vldb j.,2001
2290,optimizing database architecture for the new bottleneck : memory access,"s manegold , p boncz , m kersten",vldb j.,2000
2291,one-dimensional and multi-dimensional substring selectivity estimation,"h jagadish , o kapitskaia , r ng , d srivastava",vldb j.,2000
2292,exploiting early sorting and early partitioning for decisionsupport query processing,"j clauпen , a kemper , d kossmann , c wiesner",vldb j.,2000
2293,guest editorial,,,2000
2294,dynamic vp-tree indexing for n-nearest neighbor search given pair-wise distances,"a fu , p chan , y cheung , y moon",vldb j.,2000
2295,checking the temporal integrity of interactive multimedia documents,"i mirbel , b pernici , t sellis , s tserkezoglou , m vazirgiannis",vldb j.,2000
2296,progressive evaluation of nested aggregate queries,"k tan , c goh , b ooi",vldb j.,2000
2297,online dynamic reordering,"v raman , b raman , j hellerstein",vldb j.,2000
2298,monotonic complements for independent data warehouses,"d laurent , j lechtenbіrger , n spyratos , g vossen",vldb j.,2001
2299,efficiently publishing relational data as xml documents,"j shanmugasundaram , e shekita , r barr , m carey , b lindsay , h pirahesh , b reinwald",vldb j.,2001
2300,a survey of approaches to automatic schema matching,"e rahm , p bernstein",vldb j.,2001
2301,semantic integrity support in sql : 1999 and commercial ( object - ) relational database management systems,"c tќrker , m gertz",vldb j.,2001
2302,picodbms : scaling down database techniques for the smartcard,"p pucheral , l bouganim , p valduriez , c bobineau",vldb j.,2001
2303,approximate query mapping : accounting for translation closeness,"k chang , h garcia-molina",vldb j.,2001
2304,approximate query processing using wavelets,"k chakrabarti , m garofalakis , r rastogi , k shim",vldb j.,2001
2305,designing wrapper components for e-services in integrating heterogeneous systems,"m mecella , b pernici",vldb j.,2001
2306,active rules for xml : a new paradigm for e-services,"a bonifati , s ceri , s paraboschi",vldb j.,2001
2307,minicon : a scalable algorithm for answering queries using views,"r pottinger , a halevy",vldb j.,2001
2308,user-cognizant multidimensional analysis,s sarawagi,vldb j.,2001
2309,e-services - guest editorial,,,2001
2310,integrating and customizing heterogeneous e-commerce applications,"a eyal , t milo",vldb j.,2001
2311,an internet-based negotiation server for e-commerce,"s su , c huang , j hammer , y huang , h li , l wang , y liu , c pluempitiwiriyawej , m lee , h lam",vldb j.,2001
2312,an architecture to support scalable online personalization on the web,"a datta , k dutta , d vandermeer , k ramamritham , s navathe",vldb j.,2001
2313,the gmap : a versatile tool for physical data independence,"o tsatalos , m solomon , y ioannidis",vldb j.,1996
2314,algebraic query optimisation for database programming languages,"a poulovassilis , c small",vldb j.,1996
2315,index nesting - an efficient approach to indexing in object-oriented databases,"b ooi , j han , h lu , k tan",vldb j.,1996
2316,the design and implementation of k : a high-level knowledge-base programming language of osam * . kbms,"y shyy , j arroyo , s su , h lam",vldb j.,1996
2317,a taxonomy of correctness criteria in database applications,"k ramamritham , p chrysanthis",vldb j.,1996
2318,a predicate-based caching scheme for client-server database architectures,"a keller , j basu",vldb j.,1996
2319,type-safe relaxing of schema consistency rules for flexible modeling in oodbms,"e amiel , m bellosta , e dujardin , e simon",vldb j.,1996
2320,an asymptotically optimal multiversion b-tree,"b becker , s gschwind , t ohler , b seeger , p widmayer",vldb j.,1996
2321,building knowledge base management systems,"j mylopoulos , v chaudhri , d plexousakis , a shrufi , t topaloglou",vldb j.,1996
2322,"the hb-pi-tree : a multi-attribute index supporting concurrency , recovery and node consolidation","g evangelidis , d lomet , b salzberg",vldb j.,1997
2323,data placement in shared-nothing parallel database systems,"m mehta , d dewitt",vldb j.,1997
2324,access path support for referential integrity in sql2,"t hфrder , j reinert",vldb j.,1996
2325,a complete temporal relational algebra,"d dey , t barron , v storey",vldb j.,1996
2326,semantic and schematic similarities between database objects : a context-based approach,"v kashyap , a sheth",vldb j.,1996
2327,query processing and optimization in oracle rdb,"g antoshenkov , m ziauddin",vldb j.,1996
2328,the power of languages for the manipulation of complex values,"s abiteboul , c beeri",vldb j.,1995
2329,fibonacci : a programming language for object databases,"a albano , g ghelli , r orsini",vldb j.,1995
2330,quickstore : a high performance mapped object store,"s white , d dewitt",vldb j.,1995
2331,historical queries along multiple lines of time evolution,"g landau , j schmidt , v tsotras",vldb j.,1995
2332,tigukat : a uniform behavioral objectbase management system,"m жzsu , r peters , d szafron , b irani , a lipka , a muёoz",vldb j.,1995
2333,thщmis : a database programming language handling integrity constraints,"v benzaken , a doucet",vldb j.,1995
2334,"title , preface to the special issue on persistent object systems",,,1995
2335,orthogonally persistent object systems,"m atkinson , r morrison",vldb j.,1995
2336,mariposa : a wide-area distributed database system,"m stonebraker , p aoki , w litwin , a pfeffer , a sah , j sidell , c staelin , a yu",vldb j.,1996
2337,join algorithm costs revisited,"e harris , k ramamohanarao",vldb j.,1996
2338,parallelising oodbms traversals : a performance evaluation,"d dewitt , j naughton , j shafer , s venkataraman",vldb j.,1996
2339,priority assignment in real-time active databases,"r sivasankaran , j stankovic , d towsley , b purimetla , k ramamritham",vldb j.,1996
2340,sleepers and workaholics : caching strategies in mobile environments,"d barbarс , t imielinski",vldb j.,1995
2341,alphasort : a cache-sensitive parallel external sort,"c nyberg , t barclay , z cvetanovic , j gray , d lomet",vldb j.,1995
2342,estimating page fetches for index scans with finite lru buffers,"a swami , k schiefer",vldb j.,1995
2343,hyperfile : a data and query model for documents,"c clifton , h garcia-molina , d bloom",vldb j.,1995
2344,the software information base : a server for reuse,"p constantopoulos , m jarke , j mylopoulos , y vassiliou",vldb j.,1995
2345,an introduction to spatial database systems,r gќting,vldb j.,1994
2346,ordered shared locks for real-time databases,"d agrawal , a abbadi , r jeffers , l lin",vldb j.,1995
2347,"title , foreword , preface to the special issue on spatial database systems , index vol . 3",,,1994
2348,a semantic modeling approach for image retrieval by content,"w chu , i ieong , r taira",vldb j.,1994
2349,qualitative representation of spatial knowledge in two-dimensional space,"d papadias , t sellis",vldb j.,1994
2350,management of multidimensional discrete data,p baumann,vldb j.,1994
2351,"adaptable pointer swizzling strategies in object bases : design , realization , and quantitative analysis","a kemper , d kossmann",vldb j.,1995
2352,updating knowledge bases while maintaining their consistency,"e teniente , a olivщ",vldb j.,1995
2353,data model for extensible support of explicit relationships in design databases,"j peckham , b mackellar , m doherty",vldb j.,1995
2354,interviso : dealing with the complexity of federated database access,"m templeton , h henley , e maros , d buer",vldb j.,1995
2355,realm-based spatial data types : the rose algebra,"r gќting , m schneider",vldb j.,1995
2356,characterization of database access pattern for analytic prediction of buffer hit probability,"a dan , p yu , j chung",vldb j.,1995
2357,"the glue-nail deductive database system : design , implementation , and evaluation","m derr , s morishita , g phipps",vldb j.,1994
2358,the coral deductive system,"r ramakrishnan , d srivastava , s sudarshan , p seshadri",vldb j.,1994
2359,the aditi deductive database system,"j vaghani , k ramamohanarao , d kemp , z somogyi , p stuckey , t leask , j harland",vldb j.,1994
2360,chronological scheduling of transactions with temporal dependencies,"d georgakopoulos , m rusinkiewicz , w litwin",vldb j.,1994
2361,dynamic maintenance of data distribution for selectivity estimation,"k whang , s kim , g wiederhold",vldb j.,1994
2362,a pattern-based object calculus,"n kamel , p wu , s su",vldb j.,1994
2363,versioning and configuration management in an object-oriented data model,e sciore,vldb j.,1994
2364,the tv-tree : an index structure for high-dimensional data,"k lin , h jagadish , c faloutsos",vldb j.,1994
2365,efficiently instantiating view-objects from remote relational databases,"b lee , g wiederhold",vldb j.,1994
2366,the demarcation protocol : a technique for maintaining constraints in distributed database systems,"d barbarс , h garcia-molina",vldb j.,1994
2367,index configuration in object-oriented databases,e bertino,vldb j.,1994
2368,an introduction to deductive database languages and systems,"k ramamohanarao , j harland",vldb j.,1994
2369,declare and sds : early efforts to commercialize deductive database technology,"w kieпling , h schmidt , w strauп , g dќnzinger",vldb j.,1994
2370,sampling large databases for association rules,h toivonen,vldb,1996
2371,reordering query execution in tertiary memory databases,"s sarawagi , m stonebraker",vldb,1996
2372,query processing techniques for multiversion access methods,"j bercken , b seeger",vldb,1996
2373,a graphical query language for mobile information systems,y chang,sigmod record,2003
2374,pesto : an integrated query/browser for object databases,"m carey , l haas , v maganty , j williams",vldb,1996
2375,a multi-paradigm querying approach for a generic multimedia database management system,"j wen , q li , w ma , h zhang",sigmod record,2003
2376,query decomposition and view maintenance for query languages for unstructured data,d suciu,vldb,1996
2377,xml schema,"c campbell , a eisenberg , j melton",sigmod record,2003
2378,schemasql - a language for interoperability in relational multi-database systems,"l lakshmanan , f sadri , i subramanian",vldb,1996
2379,time management for new faculty,"a ailamaki , j gehrke",sigmod record,2003
2380,querying heterogeneous information sources using source descriptions,"a levy , a rajaraman , j ordille",vldb,1996
2381,supporting state-wide immunisation tracking using multi-paradigm workflow technology,"a sheth , k kochut , j miller , d worah , s das , c lin , d palaniswami , j lynch , i shevchenko",vldb,1996
2382,practical issues with commercial use of federated databases,j kleewein,vldb,1996
2383,an early look at xquery,"j melton , a eisenberg",sigmod record,2002
2384,integrating triggers and declarative constraints in sql database sytems,"r cochrane , h pirahesh , n mattos",vldb,1996
2385,scalablity and availability in oracle7 7.3,d gawlick,vldb,1996
2386,"rights of tods readers , authors and reviewers",r snodgrass,sigmod record,2002
2387,supporting procedural constructs in sql compilers,n mattos,vldb,1996
2388,emergent semantics and the multimedia semantic web,"w grosky , d sreenath , f fotouhi",sigmod record,2002
2389,the xps approach to loading and unloading terabyte databases,s atal,vldb,1996
2390,a framework for semantic gossiping,"k aberer , p cudrщ-mauroux , m hauswirth",sigmod record,2002
2391,large databases for remote sensing and gis,a dasgupta,vldb,1996
2392,using referential integrity to easily define consistent subset replicas,b hammond,vldb,1996
2393,amicalola report : database and information system research challenges and opportunities in semantic web and enterprises,"a sheth , r meersman",sigmod record,2002
2394,book review column,k aberer,sigmod record,2002
2395,supporting periodic authorizations and temporal reasoning in database access control,"e bertino , c bettini , e ferrari , p samarati",vldb,1996
2396,data modelling versus ontology engineering,"p spyns , r meersman , m jarrar",sigmod record,2002
2397,intra-transaction parallelism in the mapping of an object model to a relational multi-processor system,"m rys , m norrie , h schek",vldb,1996
2398,on the computation of multidimensional aggregates,"s agarwal , r agrawal , p deshpande , a gupta , j naughton , r ramakrishnan , s sarawagi",vldb,1996
2399,conceptual model of web service reputation,"e maximilien , m singh",sigmod record,2002
2400,querying a multilevel database : a logical analysis,f cuppens,vldb,1996
2401,a conceptual architecture for semantic web enabled web services,"c bussler , d fensel , a maedche",sigmod record,2002
2402,report on the first international workshop an efficient web-based information systems,,,2003
2403,information retrieval from an incomplete data cube,c dyreson,vldb,1996
2404,storage estimation for multidimensional aggregates in the presence of hierarchies,"a shukla , p deshpande , j naughton , k ramasamy",vldb,1996
2405,modeling design versions,"r ramakrishnan , d ram",vldb,1996
2406,sprint : a scalable parallel classifier for data mining,"j shafer , r agrawal , m mehta",vldb,1996
2407,"report on the first international conference on ontologies , databases and applications of semantics",,,2003
2408,obtaining complete answers from incomplete databases,ay levy,"proceedings of the international conference on very large & hellip ; ,",1996
2409,"li. , c. , and vitter . j. 2001 . supporting incremental join queries on ranked inputs","a natsev , y chang , j smith",proceedings of the very large data bases conference ( vldb ;,
2410,a database index to large biological sequences,"e hunt , mp atkinson , rw irving",,
2411,too much middleware,m stonebraker,"sigmod record ,",2002
2412,data in your face '' : push technology in perspective ( invited paper ) acm sigmod intl,"m franklin , s zdonik","conference on management of data , seattle , wa , june ,",
2413,comparing data streams using hamming norms ( how to zero in ),"g cormode , m datar , p indyk , s muthukrishnan","ieee transactions on knowledge and data engineering ,",2003
2414,devise : integrated queryingand visual explorationof large datasets,"m livny , r ramakrishnan , k beyer , g chen , d","proceedings of the 1997acm-sigmod conference ,",
2415,efficient numerical error bounding for replicated network services,hy aminvahdat,"technical report cs-2000-08 , computer science department , duke",
2416,information gathering in the world wide web : the w3ql query language and the w3qs system,"d konopnicki , o shmueli","acm transactions on database systems ,",1998
2417,ariadne : a system for constructing mediators for internet sources ( demonstration ),"j ambite , n ashish , g barish , a knoblock , s minton","proceedings of acm sigmodâ ?? 98 conference on management of & hellip ; ,",
2418,multimedia miner : a system prototype for multimedia data mining,", j han , sh chee , jy chiang","proceedings of acm-sigmod international conference on & hellip ; ,",1998
2419,a data warehouse intelligent cache manager [ c ],p schenermannâ ? ¦,"proc of the 22nd vldb conf ,",
2420,nsf workshop on industrial/academic cooperation in database systems,"m carey , l seligman","sigmod record ,",1999
2421,"selectivity estimation in spatial databases , acm sigmod intl","s achaya , v poosala , s ramaswamy","conference on management of data ,",
2422,efficient transparent application recovery,"d lomet , g weikum",client-server information systems .,
2423,parametric query optimization for linear and piecewise linear cost functions,"ah hs02 , s sudarshan",,2002
2424,report on the 18th british national conference on databases ( bncod ),"c goble , b read","sigmod record ,",2002
2425,extracting structured data from web pages,"a arasu , h garcia-molina",,
2426,optimization of dynamic query evaluation plans,"rl cole , g graefe","proceedings of the 1994 acm sigmod international conference & hellip ; ,",1994
2427,mapinfo spatialware : a spatial information server for rdbms .,c mina,"vldb ,",1998
2428,"tata probabilistic temporal databases , i : algebra","a dekhtyar , r ross , vs subrahmanian","technical report cs-tr-3987 , department of computer science ,",
2429,"merialdo & p. sindoni , g.â ?? the araneus web-base management systemâ ??","g mecca , p atzeni , a masci",acm sigmod international conference on management of,
2430,a multimedia presentation algebra,"s adalä ± , ml sapino , vs subrahmanian","sigmod ,",1999
2431,falcon : feedback adaptive loop for content-based retrieval,"t authors , c identified",,
2432,intra-transaction parallelism in the mapping of an object model to a relational multi-processor,"m rys , mc norrie , hj schek",vldb,
2433,self-similarity in the web . 2 : 205â ?? 223,"s dill , r kumar , ks mccurley , s rajagopalan , d",,2002
2434,xml document versioning,"sy chien , vj tsotras , c zaniolo","sigmod record ,",2001
2435,the adabas buffer pool manager,h schoning,,
2436,data and knowledge base research at hong kong university of science and technology,"p drew , b hamidzadeh , k karlapalem , acy kean , dl","sigmod record ,",1995
2437,"0 . g. tsatalos , sj white , and mj zwiiiing . shoring up persistent applications","mj carey , dj dewitt , mj franklin , ne hall , ml",proc . acm sigmod,
2438,cure : an efficient clustering algorithm for large databases,"g sudipto , r rastogi , k shim","proceedings of acm sigmod international conference on & hellip ; ,",
2439,videoanywhere : a system for searching and managing distributed video assets .,acms anthology,"sigmod record ,",1999
2440,improved query performance with variant indices,"poâ ?? neill , d quass","proceedings of sigmod conference ,",
2441,querying multiple features of groups in relational databases,"d chatziantoniou , ka ross","proceedings of the international conference on very large & hellip ; ,",1996
2442,comparing hierarchical data in external memory . university of maryland,ss chawathe,proceedings of the 25th vldb conference,
2443,issues in developing very large data warehouses,"l do , p drew , w jin , v jumani , d van rossum","proceedings of the international conference on very large & hellip ; ,",1998
2444,poesia : an ontological workflow approach for composing web services in agriculture,"r fileto , l liu , c pu , ed assad , cb medeiros","the vldb journal the international journal on very large & hellip ; ,",2003
2445,integrating association rule mining with relational database systems : alternatives and implications /,"s sarawagi , s thomas , r agrawal","san jose , california , usa , marz ,",
2446,contrastplotsandp-sphere trees : space vs. time in nearest neighbour searches,rr goldsteinj,"& hellip ; of the very large data bases ( vldb ) conference , cairo , egypt ,",
2447,data grid management systems,"rw moore , a jagatheesan",,
