id,title,authors,venue,year
5645,ã cents â ? ¬ å?the x-tree : an index structure for high-dimensional dataã cents â ? ¬ â ?,"s berchtold , d keim , hp kriegel",proceedings of the 22nd vldb,
5646,ganti 2002â ?? eliminating fuzzy duplicates in data warehouses,c ananthakrishna,vldb,
5647,the mariposa distributed database management system,j sidell,"sigmod record ,",1996
5648,optimizing multiple dimensional queries simultaneously in multidimensional databases,"w liang , me orlowska , jx yu","the vldb journal the international journal on very large & hellip ; ,",2000
5649,relaxed transaction processing,"mp singh , c tomlinson , d woelk",,
5650,the garlic project,e wimmers,"proceedings of the acm-sigmod conference on management of & hellip ; ,",
5651,medical information systems : characterization and challenges,"jcg ramirez , la smith","sigmod record ,",1994
5652,temporal integrity constraints with indeterminacy,"w cowley , d plexousakis",,
5653,incremental maintenance of views with duplicates,"t grin , l libkin","proceedings of the 1995 acm-sigmod international conference & hellip ; ,",1995
5654,warehousing workflow data : challenges and opportunities,"a bonifati , f casati , u dayal , mc shan","proceedings of the international conference on very large & hellip ; ,",2001
5655,ogdi : toward interoperability among geospatial databases,"g clement , c larouche , d gouin , p morin , h kucera","sigmod record ,",1997
5656,"j. ( 1994 ) , efficient and effective clustering methods for spatial data mining","rt ng , g han",proceedings of the 20th vldb,
5657,where will object technology drive data administration,a rosenthal,"sigmod record ,",1998
5658,database research : achievements and opportunities into the 21st century . report of an nsf workshop,"a silberschatz , m stonebreaker , j ullman",,1995
5659,"f , vincent , . â ?? nearest neighbor queriesâ ??","n rossopoulos , s kelly","proc . of acm-sigmod , pages ,",
5660,parallelism and its price : a case study of nonstop sql/mp . 1995,"s englert , r glasstone , w hasan","sigmod record , dec ,",
5661,supporting procedural constructs in sql compilers,n mattos,"proceedings of the international conference on very large & hellip ; ,",1996
5662,algebraic query optimisation for database programming languages,"a poulovassilis , c small","the vldb journal the international journal on very large & hellip ; ,",1996
5663,of objects and databases : a decade of turmoil . 22nd vldb conjy,"mjc cd961 , dj dewitt","bombay , india ,",
5664,discovering internet marketing intelligence through online analytical web usage mining [ j ],"ag bunchner , md mulvenna","sigmod . record ,",
5665,"8z simeon , j. ( 2000 ) , on wrapping query languages and efficient xml integration","v christophides , s cluet",proc . 2000 acm sicmod international conference on management,
5666,using random sampling for histogram construction : how much is enough,"s chaudhuri , r motwani , v narassaya","proceedings of the acm sigmod international conference on & hellip ; ,",
5667,open issues in parallel query optimization,"d florescu , w hasan , p valdurize","acm sigmod record ,",
5668,"c. , dewitt , d. , & naughton , j. ( 1999 ) relational databases for querying xml documents : limitations","jt shanmugasundaram , k he , g zhang",proceedings of the 25th vldb conference . http://www . cs .,
5669,book review column,sm databases,"sigmod record ,",2002
5670,on parallel processing of aggregate and scalar function in object-relational dbms,"m jaedicke , b mitschang",proc . acm sigmod int . conf . on management of,
5671,optimizing queries across diverse data sources,"kd haaslm , yj wimmersel","proc . ofvery large data bases conference ,",
5672,selective information dissemination in p2p networks,"m koubarakis , c tryfonopoulos , s idreos , y drougas","acm sigmod record ,",
5673,"s. , dayal , u. : an overview of datawarehousing and olap technology",cd chaudhuri,"acm sigmod record ,",
5674,a distributed algorithm for adaptive replication of data,o wolfson,,1990
5675,enhancing external consistency in real-time transactions,"kj lin , cs peng","acm sigmod record ,",1996
5676,coordinated backup and recovery between database management systems and file systems,"i narang , c mohan , k brannon , m subramanian",,
5677,multidimensional dynamic histograms,"n thaper , s guha , p indyk , n koudas","proceedings of the acm sigmod international conference on & hellip ; ,",
5678,"a critique of ansi sql isolation levels , published in :","h berenson , p bernstein , j grayâ ? ¦",proceedings of the 1995 acm sigmod,
5679,& lgr ; - db : an odmg-based object-oriented dbms,"l fegaras , c srinivasan , a rajendran , d maier",proceedings of the 2000 acm sigmod international conference,
5680,heuristic and randomized optimization for the join ordering problem,"msg moerkotte , a kemper",,
5681,coloring away communication in parallel query optimization,"w hasan , r motwani","vldb ,",1995
5682,the ins and outs ( and everthing in between ) of data warehousing,"pm fernandez , da schneider","sigmod conference ,",1996
5683,"fastmap : a fast algorithm for indexing , data mining and visualization of traditional and multimedia","c faloutsos , k lin","proc . of sigmod ,",
5684,value-cognizant speculative concurrency control,"a bestavros , s braoudakis","proceedings of the international conference on very large & hellip ; ,",1995
5685,a vision for management of complex models,ay halevy,"sigmod record ,",2000
5686,"indexing the positions of continuously moving objects , to appear in proc . sigmod int . conf","s saltenis , cs jensen , st leutenegger , ma lopez","management of data ,",
5687,improved histograms for selectivity estimation of range predicates in proc . of acm sigmod,"v poosala , ye ioannidis , pj haas , ej shekita",,1996
5688,cache portal : technology for accelerating database-driven e-commerce web sites,"ws li , ks candan , wp hsiung , o po , d agrawal , q","proceedings of the 27th international conference on very & hellip ; ,",2001
5689,using unknowns to prevent discovery of association rules,"y saygin , vs verykios , c clifton","acm sigmod record ,",2001
5690,incremental organization for data recording and warehousing,"pps narayan , s seshadri , s sudarshan , hv jagadish ,",,
5691,workshop report on experiences using object data management in the real-world,ab chaudhri,"sigmod record ,",1998
5692,eos : exactly-once e-service middleware ( demo paper ),"g shegalov , g weikum , r barga , d lomet","proceedings of the 28th international conference on very & hellip ; ,",
5693,automated selection of materialized views and indexes for sql databases,sascv narasayya,,
5694,acdn : a content delivery network for applications ( project demo ),"p karbhari , m rabinovich , z xiao , f douglis","proceedings of acm sigmod ,",
5695,on optimal node splitting for r-trees,"yj garcä ± a , ma lopez , st leutenegger","proc . very large databases ( vldb ) ,",
5696,real-time database - similarity semantics and resource scheduling,tw kuo,"sigmod record ,",1996
5697,"replication , consistency and practicality : are these mutually exclusive","a todd , b yuri , fk henry , w avishai",procs . of the acm sigmod international conf . on management,
5698,indexing large metric spaces for similarity search queries,"t bozkaya , m ozsoyoglu","acm transactions on database systems ,",1999
5699,new sampling-based summary statistics for improving approximate query answers,"pb gibbons , y matias","sigmod conference ,",1998
5700,accelerated xpath location steps,t grust,"acm sigmod ,",
5701,applying update streams in a soft real-time database system,"b adelberg , h garcia-molina , b kao","sigmod conference ,",1995
5702,estimating page fetches for index scans with finite lru buffers,"a swami , kb schiefer","the vldb journal the international journal on very large & hellip ; ,",1995
5703,local dimensionality reduction : a new approach to indexing high dimensional spaces,"k chakrabarti , s mehrotra","vldb ,",2000
5704,m-tree : an efficient access method for similarity search in metric spaces,"m patella , p ciaccia , p zezula",proceedings of the international conference on very large,
5705,re-tree : an efficient index structure for regular expressions,"c chee-yao , m garofalakis , r rastogi","proceedings of the vldb conference , hong kong ,",
5706,decision tables : scalable classification exploring rdbms capabilities [ a ],"lu hongjun , liu hongyan","proc of the 26th int conf on very large databasescairo : & hellip ; ,",
5707,fast incremental maintenance of approximate histograms,"pb gibbons , y matias , v poosala","acm transactions on database systems ,",2002
5708,metadata for integrating speech documents in a text retrieval system,"u glavitsch , p schauble , m wechsler","sigmod record ,",1994
5709,bounded aggregation : offering a precisionâ ?? performance tradeoff in replication system,"c olston , j widom","technical report , database group , stanford university ,",
5710,structured document storage and refined declarative and navigational access mechanisms in hyperstorm,"k bohm , k aberer , ej neuhold , x yang",in vldb,
5711,j. sim eon . onwrappingquerylanguages andecient xml integration,"v christophides , s cluet","proceedings of acm sigmod conf . on management of data , & hellip ; ,",
5712,querying the inernet withpier,"r huebsch , n lanham , b loo , j hellerstein , s","proceedings of 29th international conference on very large & hellip ; ,",
5713,automatic subspace clustering of high dimensional data for data mining applications,"raj gehrke , dgp raghavan",,
5714,caching strategies for data-intensive web sites,d florescu,,
5715,theast european conference adbis 2001 on advances in databases and information systems . vol . 2 â ??,"a caplinskas , j eder",,2001
5716,optimizing view queries in rolex to support navigable result trees,"p bohannon , s ganguly , hf korth , pps narayan , p","vldb ,",2002
5717,odefs : a file system interface to an object-oriented database,"nh gehani , hv jagadish , wd roome","proceedings of the 20th international conference on very & hellip ; ,",1994
5718,a new approach to developing and implementing eager database replication protocols,"b kemme , g alonso","acm transactions on database systems ,",2000
5719,energy efficient indexing on air,"t imielinski , s viswanathan , br badrinath",proceedings of the 1994 acm sigmod international conference,
5720,agent-oriented software engineering report on the 4 thaose workshop ( aose 2003 ),p giorgini,"sigmod record ,",2003
5721,the semantic web : semantics for data on the web,"s decker , v kashyap","proceedings of the international conference on very large & hellip ; ,",2003
5722,"b. shapiro , d. shasha , and k. zhang , combinatorial pattern discovery for scientific data : some","lw jt , gw chirn , tg marr","proc . sigmodâ ?? 94 ,",
5723,data analysis and mining in the life sciences,n huyn,"sigmod record ,",2001
5724,a research status report on adaptation for mobile data access,"bd noble , m satyanarayanan","sigmod record ,",1995
5725,"high-dimensional index structures , database support for next decade 's applications","s berchtold , da keim","sigmod record ,",1998
5726,materialized views in oracle,"rg bello , k dias , a downing , j feenan , j finnerty ,","proceedings of the international conference on very large & hellip ; ,",1998
5727,reusing invariants : a new strategy for correlated queries,"k ross , j rao","proceedings of the acm sigmod conference ,",
5728,querying heteregeneous information sources using source descriptions,"alj ordille , a rajaraman","international conference on very large data bases ( vldb ) ,",
5729,"answering xml queries over heterogeneous data sources , w : proc . of the 27 thinternational conference","i manolescu , d florescu , d kossmann","roma , italy",
5730,staircase join : teach a rdbms to watch its,t grust,,
5731,approximate medians and other order statistics in one pass and with limited memory : theory and,"g manku , s rajagopalan , b lindsay","proceedings of sigmod 98 , to",
5732,tabular placement of relational data on mems-based storage devices,"h yu , d agrawal","vldb ,",2003
5733,the design and performance evaluation of altervative xml storage strategies,"f tian , dj dewitt , j chen , c zhang",,2000
5734,"self-adaptive , on-line reclustering of complex object data",", r king","sigmod record ,",1994
5735,formerly known as sql3,"j melton , sql andrew eisenberg","sigmod record , feb ,",
5736,autoadmin â ?? whatifâ ?? index analysis utility,"s chaudhuri , v narasayya","proceedings of the 1998 acm sigmod international conference & hellip ; ,",
5737,"explaining differences in multidimensional aggregates , vldbâ ?? 99",s sarawagi,"proceedings of 25th international conference on very large & hellip ; ,",
5738,engineering federated information systems : report of efis '99 workshop .,acms anthology,"sigmod record ,",1999
5739,object fusion in mediator systems,"y papakostantantinou , s abiteboul , h garcia-molina","proc . 22nd international conference on very large databases & hellip ; ,",
5740,multiscale histograms : summarizing topological relations in large spatial datasets,"x lin , q liu , y yuan , x zhou",,
5741,etal . scalable techniques for mining causal structures [ a ] . vldb '98 [ c ],"c silverstein , s brin , r motwani",,1998
5742,dbglobe : a service-oriented p2p system for global computing,e pitouraâ ? ¦,"sigmod record ,",2003
5743,"processing object-oriented queries with invertible late bound functions , 21st vldb conf","s flodin , t risch","zurich , switzerland ,",
5744,"v. , â ?? template-based wrappers in the tsimmis systemâ ??","j hammer , h garcia-molina , s nestorov , r yerneni ,",proceedings of 23 rdacm sigmod international conference on,
5745,learning to match ontologies on the semantic web,"d anhai , m jayant , d robin , d pedro , h alon","the vldb journal ,",
5746,about quark digital media system,k aulakh,"sigmod conference ,",1998
5747,oasis : an online and accurate technique for local-alignment searches on biological sequences,"c meek , jm patel , s kasetty","proceedings of the international conference on very large & hellip ; ,",2003
5748,walrus : a similarity retrieval algorithm for large databases,"a natsev , r rastogi , k shim","proc . acm sigmod int . conf . on management of data , & hellip ; ,",
5749,"hill , and m. skounakis . weaving relations for cache performance","ag adhs , dj ailamaki , md dewitt",proceedings of the international conference on very large,
5750,the ins and outs of data warehousing,d schneider,tutorial on the vldb,
5751,an environmental sensor network to determine drinking water quality and security,"a ailamaki , c faloutsos , p fischbeck , m small , j","sigmod record ,",2003
5752,phoenix project : fault-tolerant applications,"r barga , d lomet","sigmod record ,",2002
5753,are we working on the right problems ? ( panel ),m stonebraker,"proceedings of the 1998 acm sigmod international conference & hellip ; ,",1998
5754,indexing and queryifig xml data for regular path expressions [ c ],"q li , b moon","proe of the 27th vldb conf , roma , italy ,",
5755,incremental updates of inverted lists for text document retrieval . technical note stan-cs-tn-93-1,"a tomasic , h garcia-molina , k shoens",,1993
5756,an adaptive hybrid server architecture for client caching object dbmss,k voruganti,,
5757,andg . slivinskas . r-treebasedindexing ofnow-relative bitemporal data,"r bliujflute , cs jensen , s saltenis","the proc . of the 24th vldb conf ,",
5758,load shedding in a data stream manager,"n tatbul , u cetintemel , s zdonik , m cherniack , m","proceedings of the international conference on very large & hellip ; ,",2003
5759,metu object-oriented dbms,"a dogac , c ozkan , b arpinar , t okay , c evrendilek",,
5760,index-driven similarity search in metric spaces,"gr hjaltason , h samet","acm transactions on database systems ,",2003
5761,spatio-temporal retrieval with rasdaman ( system demonstration ),"p baumann , a dehmel , p furtado , r ritsch , n","proc . very large data bases ( vldb ) , edinburgh ,",
5762,integrating sql databases with content-specific search engines,"s dessloch , n mattos","proceedings of the international conference on very large & hellip ; ,",1997
5763,storing and querying of e-commerce data,"r agrawal , a somani , y xu","proceedings of vldb ,",
5764,dtl 's dataspot : database exploration as easy as browsing the web,"s dar , g entin , s geva , e palmon","sigmod conference ,",1998
5765,toward an effective calculus for object query processing,"l fegaras , d maier","proc . acm sigmod conf . on management of data ,",
5766,metu interoperable database system,"ce koksal , s mancuhan","demo description , in proc . of acm",
5767,"n , l. libkin , i. mumick , h. trickey , algorithms for deferred view maintenance","l colby , t gri","proceedings of the acmsigmod conference ,",
5768,concurrent garbage collection in o2,"m skubiszewski , p valduriez","proceedings of the 23rd international conference on very & hellip ; ,",1997
5769,"rp * : a family of order-preserving scalable distributed data structures , 20 thintl","w litwin , ma neimat , d schneider","conf . on very large databases ( vldbâ ?? 94 ) ,",
5770,a family of order-preserving scalable distributed data structure,"w litwin , ma neimat , das rp","20th conf . on very large data bases , santiago , chile ,",
5771,career-enhancing services at sigmod online,"a labrinidis , ao mendelzon","sigmod record ,",2001
5772,an overview of data warehousing and olap technology . ( 1 ) : 65â ?? 74,"s chaudhuri , u dayal",,1997
5773,vipas : virtual link powered authority search in the web,"cc lin , ms chen","proceedings of the international conference on very large & hellip ; ,",2003
5774,panel : the impact of database research on industrial products ( summary ),"ja blakeley , d fishman , d lomet , m stonebraker",,
5775,"fastmap : afastalgorithmforindexing , data mining , and visualization of traditional and multimedia","c faloutsos , ki lin","sigmod record , proc.â ?? 95acm sigmod int . conf . on management & hellip ; ,",
5776,advances in databases and information systems,"a caplinskas , j eder",,
5777,keimda ( 2000 ) whatisthenearest neighbor in high dimensional spaces,acc hinneburga,proceedings of the vldb,
5778,"the new locking , logging , and recovery architecture of microsoft sql server 7.0",d campbell,"proceedings of the international conference on very large & hellip ; ,",1999
5779,management of multidimensional discrete data,p baumann,"the vldb journal the international journal on very large & hellip ; ,",1994
5780,birch : an efficient data clustering method for very large databases,tzrrm livny,,1998
5781,approximate medians and other quantiles in one pass and with limited memory,"b lindsay , g manku , s rajagopalan","proc . acm sigmod ,",
5782,pixel-oriented database visualizations,da keim,"sigmod record ,",1996
5783,integrating information for on demand computing,nm mattos,"proceedings of the international conference on very large & hellip ; ,",2003
5784,coma-a system for flexible combination of sehema matehing approaehes [ c ],"hh do , e rahm","vldb conferenee ,",
5785,avi pfeffer generalized search trees for database systems ( 1995 ) proc . 21st int,"jm hellerstein , jf naughton","conf . very large data bases ,",
5786,an orthogonally persistent java . number 1,"mp atkinson , l daynes , mj jordan , t printezis , s",,1996
5787,"cosima-your smart , speaking e-salesperson","w kieî ² ling , s holland , s fischer , t ehm","proceedings of the 2001 acm sigmod international conference & hellip ; ,",2001
5788,capturing global transactions from multiple recovery log files in a partitioned database system,"c liu , bg lindsay","proceedings of the international conference on very large & hellip ; ,",2003
5789,"social , educational , and governmental change enabled through information technology","k ramamritham , c batini , m eitan , v gregg , db","proceedings of the international conference on very large & hellip ; ,",2000
5790,efficient filtering of xml documents for selective dissemination of information - group of 2 & raquo ;,"m altinel , mj franklin","proceedings of the 26th international conference on very & hellip ; ,",2000
5791,querying shapes of histories,"r agrawal , g psaila , el wimmers","proceedings of the international conference on very large & hellip ; ,",1995
5792,polymorphism and type inference in database programming,"p buneman , a ohori","acm transactions on database systems ,",1996
5793,information management challenges from the aerospace industry,sm sripada,"vldb ,",2002
5794,dynamic itemset counting and implication rules,"s brin , r motwani , j ullman , s tsur","proceedings acm sigmod , international conference on",
5795,filtering algorithms and implementation for very fast publish/subscribe systems,"j pereira , f fabret , ha jacobsenâ ? ¦","proceedings of the 4th acm special interest group on & hellip ; ,",
5796,socqet : semantic olap with compressed cube and summarization ( demo paper ) in,"l lakshmanan , j pei , y zhao",,
5797,the ecobase project : database and web technologies for environmental information systems ',l bouganim,"acm sigmod record , september ,",2001
5798,research issues for data communication in mobile ad-hoc network database systems,"ld fife , l gruenwald","sigmod record ,",2003
5799,on-line warehouse view maintenance,dqj widom,,
5800,an asymptotically optimal multiversion b-tree,"b becker , s gschwind , t ohler , b seeger , p","the vldb journal the international journal on very large & hellip ; ,",1996
5801,optimizing database architecture for the new bottleneck : memory access,"s manegold , pa boncz , ml kersten","the vldb journal the international journal on very large & hellip ; ,",2000
5802,xpath processing in a nutshell,"g gottlob , c koch , r pichler","sigmod record ,",2003
5803,implementation of magic-sets in a relational database system,"is mumick , h pirahesh","sigmod conference ,",1994
5804,advances in databases and information systems report of 5 theast european conference adbis ' 20o,"a caplinskas , o vasilecas","sigmod record ,",2002
5805,improving index performance through prefetching,"c shimim , pb gibbons , tc mowny","acm sigmod ,",
5806,tigukat : a uniform behavioral objectbase management system,"mt ã?zsu , r peters , d szafron , b irani , a lipka , a","the vldb journal the international journal on very large & hellip ; ,",1995
5807,a comprehensive xquery to sql translation using dynamic interval encoding,"d dehaan , d toman , mp consens","sigmod conference ,",2003
5808,indexing the distance : an efficient method to knn processing,"c yu , bc ooi , kl tan , hv jagadish","vldb ,",2001
5809,efficient similarity search for market basket data,"a nanopoulos , y manolopoulos","the vldb journal the international journal on very large & hellip ; ,",2002
5810,opportunities in information management and assurance,x qian,"acm sigmod record ,",1997
5811,datablitz : a high performance main-memory storage manager,j baulier,,
5812,the idea web lab,"s ceri , p fraternali , s paraboschi",,
5813,materialization view selection in a multidimensional database,"e baralis , s paraboschi , e teniente",proceedings of the 23rd vldb,
5814,an approach for building secure database federations in jorge b. bocca and matthias jarke and carlo,"d jonscher , kr dittrich","proceedings of 20th international conference on very large & hellip ; ,",
5815,a toolkit for negotiation support interfaces to multi-dimensional data,"m gebhardt , m jarke","sigmod conference ,",1997
5816,diag-join : an opportunistic join algorithm for 1 : n relationships,shtwg moerkotte,,
5817,generalized search trees for database systems . 21st vldb,"jm hellerstein , jf naughton , a pfeffer","zurich , switzerland , sept ,",
5818,implementing deletion in b + - trees,j jannink,"sigmod record ,",1995
5819,robust estimation with sampling and approximate pre-aggregation,c jermaine,"proceedings of the international conference on very large & hellip ; ,",2003
5820,on saying '' enough already ! '' in sql,"mj carey , d kossmann",,
5821,delaunay : a database visualization system,ifcm averbuch,,
5822,your mediatms need data conversion,"s cluet , c delobel , j simã © on , k smaga",proc . of acm sigmod conference on conference of management,
5823,schema and database evolution in the oâ 3/4 object database system,"f ferrandina , t meyer , r zicari , g ferran , j madec",proc . of the 21st intâ ?? l conf . on very large databases (,
5824,on functional properties of information filtering,"r sawai , m tsukamoto , t terada , yh loh , s nishio","electronics and communications in japan ( part ii electronics ) ,",2003
5825,fast computations of sparse cubes,"d srivastava , k ross","proceedings of the 23rd international conference on very & hellip ; ,",
5826,efficient approximation of optimization queries under parametric aggregation constraints,"s guha , d gunopulos , n koudas , d srivastava , m","proceedings of the international conference on very large & hellip ; ,",2003
5827,using metadata for the intelligent browsing of structured media objects,"wi grosky , f fotouhi , ik sethi","sigmod record ,",1994
5828,optimal histograms with quality guarantees,"s muthukrishnan , v poosala , t suel","bell labs technical report , may 1998 . [ or861 f. olken and d.",
5829,near neighbor search in large metric spaces . 21st vldb,s brin,"zurich , switzerland , sept ,",
5830,data placement in shared-nothing parallel database systems,s padmanabhan,,1992
5831,agora : living with xml and relational,"dkfxd olteanu , i manolescu , d florescu","proceedings of the 26th vldb conference , cairo , egypt ,",
